Score,Title,Author,Subreddit,Domain,Self Post?,NSFW,SubmissionID
1,745,"Gonzales proposes new crime: ""Attempted"" copyright infringement",mdw,reddit.com,news.com.com,False,False,1qu5a
0,366,"John McCain on Asians"" - ""I will hate them as long as I live.""",,reddit.com,seattlepi.nwsource.com,False,False,6724n
2,2723,"Fuck You CNN, there's nothing controversial about 
an American President advising American students 
to do better in school.",elvisliveson,reddit.com,cnn.com,False,False,9ihfz
0,9,"Most of MSM Yawns, Rolls Over As Largest Union Theft in History Goes Largely Unreported",alllie,reddit.com,bigjournalism.com,False,False,ar7dz
0,1,Watch England FA Cup Live Free Football Match Gillingham vs Aston Villa !!! Live & Highlights !!!,abeer58,sports,newsofworldsports.blogspot.com,False,False,7n8vi
0,423,Dog being bullied by a Tortoise saved by Super Tortoise. ,Neuraxis,videos,youtube.com,False,False,bkgg1
0,351,"Whenever I see this, I pretty much always upvote the older one and downvote the newer one.  I'm just sayin...",,pics,imgur.com,False,False,b5n2m
0,102,"Reddit, please help. My abusive ex is starting to do his shit with my daughter and I don't know how to stop it.",,AskReddit,self.AskReddit,True,False,9dexw
0,196,"Say ""WHAT"" Again, I Dare You [PIC]",nvidovich,pics,imgur.com,False,False,9xv07
1,969,Getting owned online after street racing by the cop who gave him the ticket.,rainmanjam,WTF,i40.tinypic.com,False,False,7rgjz
